{"$schema":"https://json-schema.org/draft/2020-12/schema","description":"org-001 manifest schema v1","properties":{"authority":{"properties":{"declared_valence":{"enum":["disproven","candidate","proven"],"type":"string"},"granted_capabilities":{"items":{"type":"string"},"type":"array"},"mutation_class":{"enum":["read_only","write","external_effect"],"type":"string"},"required_capability":{"type":["string","null"]}},"required":["mutation_class","declared_valence"],"type":"object"},"codon":{"pattern":"^[a-z0-9]{2}$","type":"string"},"contracts":{"items":{"properties":{"description":{"minLength":1,"type":"string"},"input_schema":{"type":"object"},"mutation_class":{"enum":["read_only","write","external_effect"],"type":"string"},"op":{"maxLength":64,"minLength":1,"type":"string"},"required_capability":{"type":"string"}},"required":["op","description","input_schema"],"type":"object"},"minItems":1,"type":"array"},"description":{"minLength":1,"type":"string"},"name":{"pattern":"^[a-z0-9][a-z0-9-]{0,63}$","type":"string"},"receipt_policy":{"properties":{"algorithm":{"const":"sha256","type":"string"},"chain":{"const":true,"type":"boolean"},"content_addressed":{"const":true,"type":"boolean"}},"required":["content_addressed","algorithm","chain"],"type":"object"},"schema_version":{"const":"1","type":"string"},"transports":{"items":{"enum":["native","unix_socket","mcp","rest"],"type":"string"},"minItems":1,"type":"array"},"version":{"pattern":"^[0-9]+\\.[0-9]+\\.[0-9]+$","type":"string"}},"required":["schema_version","name","codon","version","description","contracts","authority","transports","receipt_policy"],"title":"OrganelleManifest","type":"object"}
