{"authority":{"declared_valence":"proven","granted_capabilities":[],"mutation_class":"write","required_capability":"wd.decide"},"codon":"wd","contracts":[{"description":"run one change through the decision pipeline (merge-free); seals or returns a pending draft","input_schema":{"properties":{"change":{"type":"object"},"in_flight":{"items":{"type":"object"},"type":"array"},"merged":{"items":{"type":"string"},"type":"array"},"ts":{"type":"string"},"view":{"type":"object"}},"required":["change","view","ts"],"type":"object"},"mutation_class":"write","op":"decide","required_capability":"wd.decide"},{"description":"seal an accepted draft after the substrate merged it","input_schema":{"properties":{"draft":{"type":"object"},"merge_sha":{"type":"string"},"port_name":{"type":"string"},"ts":{"type":"string"}},"required":["draft","merge_sha","port_name","ts"],"type":"object"},"mutation_class":"write","op":"complete_merge","required_capability":"wd.decide"},{"description":"decision chain head + sealed count","input_schema":{"properties":{},"required":[],"type":"object"},"mutation_class":"read_only","op":"chain_status"},{"description":"liveness probe (no state touched)","input_schema":{"properties":{},"required":[],"type":"object"},"op":"ping"}],"description":"wreck deterministic merge authority: decide change claims, seal verdicts into a hash-chained decision log","name":"wreck-decide","receipt_policy":{"algorithm":"sha256","chain":true,"content_addressed":true},"schema_version":"1","transports":["native","unix_socket","mcp","rest"],"version":"0.1.0"}