{"authority":{"declared_valence":"proven","granted_capabilities":[],"mutation_class":"read_only","required_capability":null},"codon":"wc","contracts":[{"description":"fetch one rule by id (history kept, superseded included)","input_schema":{"properties":{"id":{"type":"string"}},"required":["id"],"type":"object"},"op":"get_rule"},{"description":"non-superseded rules, id-sorted","input_schema":{"properties":{},"required":[],"type":"object"},"op":"active_rules"},{"description":"derive a governor Policy from active contract-forbidding rules","input_schema":{"properties":{},"required":[],"type":"object"},"op":"to_policy"},{"description":"append a rule (a superseding id replaces the old one in active set)","input_schema":{"properties":{"rule":{"type":"object"}},"required":["rule"],"type":"object"},"mutation_class":"write","op":"insert_rule","required_capability":"wc.write"}],"description":"wreck canonical rule authority: standing rules with provenance, supersede-not-mutate, policy derivation","name":"wreck-canon","receipt_policy":{"algorithm":"sha256","chain":true,"content_addressed":true},"schema_version":"1","transports":["native","unix_socket","mcp","rest"],"version":"0.1.0"}