{"authority":{"declared_valence":"proven","granted_capabilities":[],"mutation_class":"read_only","required_capability":null},"codon":"wl","contracts":[{"description":"construct and validate a ChangeClaim (status PROPOSED)","input_schema":{"properties":{"agent_id":{"type":"string"},"base":{"type":"string"},"change_id":{"type":"string"},"head":{"type":"string"},"intent":{"type":"string"},"task_id":{"type":"string"}},"required":["change_id","agent_id","task_id","base","head","intent"],"type":"object"},"op":"propose"},{"description":"apply one legal forward status move to a claim (by value)","input_schema":{"properties":{"claim":{"type":"object"},"next":{"type":"string"}},"required":["claim","next"],"type":"object"},"op":"transition"},{"description":"validate a change id (2-63 chars, alnum plus . - _)","input_schema":{"properties":{"id":{"type":"string"}},"required":["id"],"type":"object"},"op":"validate_change_id"},{"description":"validate a 40-hex git sha (lowercased)","input_schema":{"properties":{"s":{"type":"string"}},"required":["s"],"type":"object"},"op":"sha"},{"description":"sha256 content hash of any JSON value","input_schema":{"properties":{"value":{}},"required":["value"],"type":"object"},"op":"content_hash"}],"description":"wreck change-claim lifecycle: propose, forward-only status transitions, id/sha validation, content hashing","name":"wreck-claim","receipt_policy":{"algorithm":"sha256","chain":true,"content_addressed":true},"schema_version":"1","transports":["native","unix_socket","mcp","rest"],"version":"0.1.0"}