{"authority":{"declared_valence":"proven","granted_capabilities":[],"mutation_class":"read_only","required_capability":null},"codon":"wg","contracts":[{"description":"classify the relationship between two change views (empty = compatible)","input_schema":{"properties":{"a":{"type":"object"},"b":{"type":"object"},"merged":{"items":{"type":"string"},"type":"array"},"policy":{"type":"object"}},"required":["a","b"],"type":"object"},"op":"classify"},{"description":"greedy deterministic merge candidate over views: accepted ids + rejections","input_schema":{"properties":{"merged":{"items":{"type":"string"},"type":"array"},"policy":{"type":"object"},"views":{"items":{"type":"object"},"type":"array"}},"required":["views"],"type":"object"},"op":"build_candidate"},{"description":"function names enclosing line ranges in Rust source","input_schema":{"properties":{"ranges":{"items":{"items":{"type":"integer"},"type":"array"},"type":"array"},"source":{"type":"string"}},"required":["source","ranges"],"type":"object"},"op":"enclosing_functions"}],"description":"wreck deterministic conflict analysis: classify change pairs, build merge candidates, map line ranges to enclosing functions","name":"wreck-conflict","receipt_policy":{"algorithm":"sha256","chain":true,"content_addressed":true},"schema_version":"1","transports":["native","unix_socket","mcp","rest"],"version":"0.1.0"}