{"authority":{"declared_valence":"proven","granted_capabilities":[],"mutation_class":"read_only","required_capability":null},"codon":"wx","contracts":[{"description":"build the mechanical ChangeView from (base, head) via git diff","input_schema":{"properties":{"base":{"type":"string"},"change_id":{"type":"string"},"head":{"type":"string"},"repo":{"type":"string"},"scope":{"items":{"type":"object"},"type":"array"}},"required":["repo","change_id","base","head"],"type":"object"},"op":"git_diff_view"},{"description":"enrich a ChangeView with measured enclosing function names","input_schema":{"properties":{"head":{"type":"string"},"repo":{"type":"string"},"view":{"type":"object"}},"required":["repo","head","view"],"type":"object"},"op":"git_measure_symbols"},{"description":"fetch the fork head into the baseline and merge --no-ff","input_schema":{"properties":{"baseline":{"type":"string"},"change":{"type":"object"},"fork":{"type":"string"}},"required":["baseline","fork","change"],"type":"object"},"mutation_class":"external_effect","op":"git_merge","required_capability":"wx.merge"}],"description":"wreck substrate layer: build change views from local git, measure symbols, execute merges","name":"wreck-substrate","receipt_policy":{"algorithm":"sha256","chain":true,"content_addressed":true},"schema_version":"1","transports":["native","unix_socket","mcp","rest"],"version":"0.1.0"}